item_id,shop_id,comment,rate_star,label
20193328854,76448301,Loa phù_hợp với giá tiền nha mọi người.nhỏ nhỏ cinh cinh phù_hợp cầm đi các quán cafe chill . nếu chỗ đông người thì nên chọn loa công_suất to hơn . cmt mang tính_chất nhận xu,5,0
20193328854,76448301,Loa nghe ổn nhưng thấy cái logo hơi lệch lệch còn đâu mọi thứ đều ổn,5,0
20193328854,76448301,"Sản_phẩm tốt , shop tư_vấn rất nhiệt_tình .",5,0
20193328854,76448301,"giao hàng nhanh , đóng_gói kĩ có bọc chống sốc . loa nghe to khá oke nheeee chất_lượng âm_thanh kh rè bass vừa",5,0
20193328854,76448301,"Hàng giao nhanh , loa nghe to .",5,0
20193328854,76448301,"Loa phù_hợp với giá , để trang_trí rất đẹp .",5,0
20193328854,76448301,Loa to nghe êm tai .,5,0
20193328854,76448301,"Chất_lượng sản_phẩm : Giá_cả phù_hợp , tiết_kiệm được ối tiền , hàng mới 100 , , giao hàng đúng hẹn .",5,0
20193328854,76448301,Giao hàng nhanh_chóng .,5,0
20193328854,76448301,Hàng fake thì dĩ_nhiên không đòi_hỏi gì nhiều ở chất âm .,5,0
20193328854,76448301,"Mang đến cty bật nghe thấy ae khen hay nhiều , Giá_cả hợp_lý mà không thua hàng thật là bao .",5,0
20193328854,76448301,Âm_thanh nghe tốt hàng đonga gói kỹ_càng ủng_hộ shop .,5,0
20193328854,76448301,"Loa hay , chất âm ok , mẫu_mã đẹp , so về độ giống real thì tầm 60 , .",5,0
20193328854,76448301,Hàng đóng_gói ok....giao ổn .. nge cũng hay .. tiết là ko chỉnh âm điu đc .,5,0
20193328854,76448301,Bass sẽ k đc rung như loa xịn nhưng nhu_cầu chỉ để nghe tiếng anh nên quá là ok .,5,0
23627892654,76448301,"Chất_lượng sản_phẩm : ok Tính_năng nổi_bật : ok Đóng_gói cẩn thân , sản_phẩm giống hình",5,0
23627892654,76448301,Chất_lượng sản_phẩm : tốt Tính_năng nổi_bật : hơn cả mong_đợi Đã nhận được hàng sản_phẩm ưng_ý .,5,0
23627892654,76448301,"Tính_năng nổi_bật : quá bền Chất_lượng sản_phẩm : tốt nha Sẽ ủng_hộ nhiều hơn , nên mua nha mọi người",5,0
23627892654,76448301,"Chất_lượng sản_phẩm : tốt Tính_năng nổi_bật : chưa biết Hộp chắc_chắn , nghe tốt , giao hàng nhanh , nên mua nha mn",5,0
23627892654,76448301,Chất_lượng sản_phẩm : tốt Tính_năng nổi_bật : nghe kh bị phát_âm ra ngoài Với giá chưa đến 100k sản_phẩm tốt,5,0
23627892654,76448301,"Chất_lượng sản_phẩm : tốt Sản_phẩm tốt ạ , shipper thân_thiện và giao hàng nhanh",5,0
23627892654,76448301,Chất_lượng sản_phẩm : tốt Tính_năng nổi_bật : được Nhận hàng bóc hàng ra và cảm_thấy rất ưng_ý và nhìn thấy rất chắc_chắn có cơ_hội sẽ ủng_hộ shop tiếp_tục .,5,0
23627892654,76448301,"Chất_lượng sản_phẩm : tốt Tính_năng nổi_bật : good nha săn sale nên được giá rẻ , sản_phẩm tốt sẽ mua lại .",5,0
23627892654,76448301,"Chất_lượng sản_phẩm : ok Tính_năng nổi_bật : được ok lắm ạ , mình đặt ở shop này lần thứ 2 rùi , nói_chung rất ok , k có cái nào bị lỗi cả , sau_này sẽ mua ở đây tiếp",5,0
23627892654,76448301,"Chất_lượng sản_phẩm : hơn cả mong_đợi Tính_năng nổi_bật : tốt nha Nói_chung là cực_kì đáng mua nha , ship cũng nhanh nữaaaa",5,0
23627892654,76448301,"Hàng dùng tốt tem mác đàng_hoàng , đóng_gói cẩn_thận , giao hàng nhanh",5,0
23627892654,76448301,Chất_lượng sản_phẩm : tốt nha Tính_năng nổi_bật : good nha Sản_phẩm tốt và rất nên mua .,5,0
23627892654,76448301,Chất_lượng sản_phẩm : hơn cả mong_đợi Tính_năng nổi_bật : tốt nha sản_phẩm shop gửi ok đúng loại mình lên đơn ưng_ý cho shop 5 Sao ủng_hộ ... lần sau có nhu_cầu mình lại ghé shop nha,5,0
23627892654,76448301,"Mọi thứ đều ổn , giong nhu hinh , nghe duoc ca hai ben , ship nhanh , nếu có cơ_hội sẽ ủng_hộ shop lần nữa ,",5,0
23627892654,76448301,"Chất_lượng sản_phẩm : hơn cả mong_đợi Tính_năng nổi_bật : được Lần đầu tiền mua hàng nhưng rất hài_lòng về chất_lượng sản_phẩm , shop tư_vấn nhiệt_tình .",5,0
23171914090,76448301,"Chất_lượng sản_phẩm : Âm_thanh ok , bass mạnh , không rè Shop giao sản_phẩm bị thiếu mất miếng vành loa màu đen , nhắn shop mà không trả_lời .",3,0
23171914090,76448301,"Hình_ảnh mang tính_chất nhận Xu_Thật không_thể tin được chất_lượng của sản_phẩm này quá tốt mà_lại còn được giảm_giá nữa chứ Mua được với giá ưu_đãi thích lắm , còn mua đúng sản_phẩm mình thích bấy_lâu_nay nữa Shop tuyệt_vời và ủng_hộ lâu_dài Vote cho shop 5",5,0
23171914090,76448301,Mua màu đen mà gửi màu trắng.đc cái mẫu_mã đẹp.chất lượng âm_thanh ổn,5,0
23171914090,76448301,Tính_năng nổi_bật : loa nghe rất ok nha mọi người Chất_lượng sản_phẩm :,5,0
23171914090,76448301,"Tính_năng nổi_bật : nghe nhạc Chất_lượng sản_phẩm : Tốt_Mình mua giùm nên không có ảnh vs video khui hàng , nhưng đc ngta khen loa chất_lượng , đẹp .",5,0
23171914090,76448301,"Gửi hàng không đúng với mã đặt , đặt loa V8 gửi loa A88 mà không báo trước , mã A88 rẻ hơn",1,1
23171914090,76448301,"Chất_lượng sản_phẩm : Tốt_Lúc bth thì nt là shop tl còn lúc hàng có vấn_đề mà mình chỉ muốn hỏi thôi chứ k có ý khiếu_nại hay đổi trả j cả mà shop k thèm rep tn , có rep thì cũng rep cho có , đang hỏi thì tl dạ cảm_ơn là sao shop ?",1,1
23171914090,76448301,Chất_lượng sản_phẩm : tot Tính_năng nổi_bật : nghe êm qưertyuiopasdfghjklzxcvbnm12345678901 chiq,5,0
23171914090,76448301,Loa_To hơn tưởng_tượng Sài rất ok nên mua nha ae ko cần suy_nghĩ,5,0
23171914090,76448301,loa led dep lam,5,0
23171914090,76448301,Loa cùi lắm tui khuyên với tầm giá này sẽ nên mua xtobo hoặc intromax ok hơn chứ mua này về tui Sài 3 bữa hư rồi,1,1
23171914090,76448301,"Pin 1600mah , trong khi phần giới_thiệu ghi 6000 mah .",1,1
23171914090,76448301,Loa đẹp nhưg giao sai màu nhắn_tin shop k tl,3,0
23171914090,76448301,Sản_phẩm ko đúng với thông_tin shop đưa,1,1
18382735233,76448301,Loa hát ổn trong tầm giá nghe trong không bị rè Mình đã mua 2 cái,5,0
18382735233,76448301,Sản_phẩm quá tuyệt_vời lần sau sẽ tiếp_tục ủng_hộ shop nhé mãi yêu,5,0
18382735233,76448301,"4 , vì chất_lượng dịch_vụ sau bán hàng quá kém",4,0
22866371279,76448301,Shop giao sai mẫu màu cũng sai .,1,1
20100542623,76448301,Shop giao hàng nhanh lắm .,5,0
20100542623,76448301,"Lắp vừa tai , nghe khá êm tai , đã dùng thử 1 tgian mới đánh_giá , đôi_lúc bị mất kết_nối 1 tai , kết_nối lại thì ok , cảm_ứng chạm thì bình_thường , ấn tăng giảm âm_lượng hơi chậm , nghe nhận cuộc_gọi ổn , cũng chỉ để nghe nhạc xem phim nên thấy đc",5,0
20100542623,76448301,Giao hàng nhanh .,1,1
20100542623,76448301,"Giao hàng nhanh , đóng_gói nhỏ gọn , sản_phẩm đúng như quảng_cáo , giống hình , rẻ hơn so với giá bên ngoài , như_vậy ok quá rồi sẽ ủng_hộ shop tiếp , đánh_giá shop 5 sao , hình_ảnh chỉ mang tính_chất để nhận xu",5,0
20100542623,76448301,"Chất_lượng sản_phẩm : Tuyệt_vời Đã test , dùng rất ok , Kết_nối bluetooth ổn_định ko bị đứt_đoạn , 2 tai nghe to , đều nhau , pin khoẻ .",5,0
20100542623,76448301,"Chất_lượng sản_phẩm : sản_phẩm sử_dụng ổn_định Kết_nối với máy_tính , điejen thoại tốt , âm_thanh rõ",5,0
20100542623,76448301,Đã nhận được hàng sản_phẩm ưng_ý .,5,0
20100542623,76448301,"săn sale nên được giá rẻ , sản_phẩm tốt sẽ mua lại .",5,0
20100542623,76448301,"Hàng chuẩn , ok , sẽ ủng_hộ tiếp lần sau , đóng_gói đẹp , giao hàng nhanh ...",5,0
20100542623,76448301,Các b yên_tâm mua hàng nhé .,5,0
20100542623,76448301,"Đóng_gói cẩn thân , sản_phẩm giống hình .",5,0
20100542623,76448301,"Lần đầu tiền mua hàng nhưng rất hài_lòng về chất_lượng sản_phẩm , shop tư_vấn nhiệt_tình .",5,0
20100542623,76448301,"Chất_lượng sản_phẩm : âm_thanh ổn mic tạm đc kết_nối rất chập_chờn , tai bé đeo sẽ k hợp đeo vài tiếng sẽ rất đau , cảm_ứng chạm k nhạy nói_chung là tiền_nào_của_nấy mua để nghe nhạc thì đc",1,1
20100542623,76448301,"Chất_lượng sản_phẩm : mẫu_mã đẹp Giá ổn nhưng chưa biết chất_lượng bền không , âm_thanh ok",4,0
20100542623,76448301,Giao hàng nhanh_chóng Đóng_gói cẩn_thận Sản_phẩm đẹp Shop nhiệt_tình Ban_đầu hơi khó kết_nối một lúc sau mới kết_nối đc,5,0
22877969961,76448301,Shop chuẩn_bị và giao hàng nhanh_chóng đóng_gói cẩn_thận không bị trầy_xước gì,5,0
22877969961,76448301,"Sản_phẩm được thiết_kế nguyên khối hình_chữ_nhật , với các góc_cạnh được bo tròn mềm_mại .",5,0
22877969961,76448301,"màu xinh lắm ạ xinh hơn trong ảnh luôn ạ , shop phục_vụ rất chu_đáo và nhiệt_tình , shop đóng_gói cẩn_thận ạ , shipper vui_tính nhiệt_tình ạ",5,0
22877969961,76448301,Mình đã nhận được hàng .,5,0
22877969961,76448301,"Shop giao nhanh , đóng_gói cẩn_thận , đúng mẫu .",5,0
22877969961,76448301,"Màu đẹp xinh , nhìn cái mẫu đã xinh rồi , giá rẻ , sạc được khá lâu , mà cũng nhanh vào pin , shop giao nhanh , mua lần thứ 2 nên yên_tâm về chất_lượng",5,0
22877969961,76448301,"màu này nhìn cute mà shop thân_thiện tư_vấn nhiệt_tình lắm , pin sạc trâu mà vào nhanh nữa quá hợp_lí so bới giá tiền",5,0
22877969961,76448301,"màu giao xinh lắm ạ cute xỉu đẹp hơn trong ảnh nha , sạc nhanh lâu hết mà shop đóng_gói cẩn_thận đáng mua ạ",5,0
22877969961,76448301,"hông ngờ với giá này mà mua đc con sạc ngon v , màu hồng xinh xỉu , sạc vào nhanh mà dùng được lâu lắm , mình đi học thêm sạc hơn 2 tuếng mà_còn chưa chết nữa",5,0
22877969961,76448301,"Shop tư_vấn nhiệt tính , gói hàng cẩn_thận , đi đơn nhanh , sạc đẹp màu xinh",5,0
22877969961,76448301,Chất_lượng sản_phẩm : cũng tạm Đúng với mô_tả : ddusng Giao hàng nhanh Hộp sạc xịn xò lắm Có_điều sạc đầy cục sạc hơi lâu,5,0
22877969961,76448301,"Chất liêụ pin dày_dặn chắc_chắn , mình có lỡ lm rớt nhưng ko bị nứt vỡ , dùng lại đc lâu",5,0
22877969961,76448301,"Sp nổi_tiếng dành cho các bạn chưa biết pin sạc dự_phòng nào tốt , giá phải_chăng trên thị_trường .",5,0
22877969961,76448301,sản_phẩm rất bền và an_toàn cho người sử_dụng,5,0
22877969961,76448301,"Sạc nhanh , tiết_kiệm thời_gian",5,0
18344910325,76448301,Hàng dùng OK sợ với tầm giá .,5,0
18344910325,76448301,Rất hài_lòng về sản_phẩm .,5,0
18344910325,76448301,Đã nhận được sản_phẩm ship nhiệt_tình đóng_gói hàng cẩn_thận nhé .,5,0
18344910325,76448301,Quà tặng sinh_nhật nên rep shop giao nhanh mà thâtj bất_ngờ là kịp tặng luôn trong vòng 1 ngày .,5,0
18344910325,76448301,"cái phần nam_châm nó đóng vào siêu lỏng_lẻo luôn í không hút mạnh như các loại khác , không nên mua",1,1
18344910325,76448301,"Sản_phẩm đóng_gói cẩn_thận , mẫu_mã đẹp đúng như hình , chất_lượng thì chưa test",5,0
18344910325,76448301,"Trơ , i ơi .",5,0
18344910325,76448301,"Chất_lượng sản_phẩm : tay nghe Bluetooth_Tính năng nổi_bật : êm tay2 Mình đã mua sản_phẩm bên shop 2 lần hàng rất là OK ạ , lúc đầu mua thì tưởng shop giao hàng xước như ko phải , shop dán một lớp keo ạ",5,0
18344910325,76448301,Hàng giao nhanh phục_vụ tốt chất_lượng sản_phẩm thì dùng một thời_gian mới biết được nhưng nhìn_chung bên ngoài hàng đẹp như hình và miêu_tả của shop.hơn mong_đợi chứ ko như các shop ảo trá_hình mua xong về làm rác vứt vô sọt.nói chung là cho 1200 like cho shop và sẽ tiếp_tục ủng_hộ cho shop nhiều,5,0
18344910325,76448301,Con thứ 3 của shop .,5,0
18344910325,76448301,"Đóng_gói hàng cẩn_thận , hộp ko bị méo , chất_lượng sản_phẩm tuyệt_vời , giá tiền hợp_lí , mọi người nên mua nha",5,0
18344910325,76448301,"Hàng giao đúng hạn , mẫu_mã đẹp , k xước .",5,0
18344910325,76448301,"Giao hàng bình_thường , hàng đóng_gói kỹ , có tâm tặng thêm một cáp cổng usb để kết_nối với sạc 5w ip , chất_lượng đi theo giá tiền , quá ok",5,0
18344910325,76448301,Hàng ok nhé chất_lượng cũng ok nhé giá quá là hợp_lí so với thị_trường nha cả nhà nói_chung lên mua cho shop tỉ sao lun hihi,5,0
18344910325,76448301,"Mình đã nhận dc hàng , gói hàng rất chắc_chắn ... dùng thử âm_thanh rất ok , nó chung rất hhai2 lòng về sản_phẩm ... thank shop , , ,",5,0
22077966900,76448301,", Shop giao hàng siu siu nhanh .",5,0
22077966900,76448301,Sử_dụng gần 1 tháng r mới đánh_giá .,5,0
22077966900,76448301,Đã nhận được hàng rồi nhé mà mở to bị rè nên cho 4 sao thôi nghe cũng ổn,4,0
22077966900,76448301,"Loa sài oki lắm , chất_lượng âm_thanh tốt , nghe êm tai.shop đóng_gói cẩn thận.nên mua",5,0
22077966900,76448301,nghe hay . bass sâu . chất_lượng âm_thanh hay . nghe cực ok trong tầm tiền này . ae nào còn đang chọn_lựa tai nghe thì m khuyên nên chọn em này,5,0
22077966900,76448301,Mình nhận được hàng nha shop .,5,0
22077966900,76448301,"Ui loa nghe êm nha , mở to ko bị rè nè .",5,0
22077966900,76448301,"To nghe âm_thanh to , tiện_lợi mang đi du_lịch picnic , âm có chỉnh độ vang bắt tiếng tốt .",5,0
22077966900,76448301,"Tai nghe chất_liệu cũng dc , khá chắc_tay , mỗi_tội là fake nên k dùng nhấc máy được , hơi bất_tiện , huhu",5,0
22077966900,76448301,"Loa nghe chất quá shop , nghe bass ok đấy",5,0
22077966900,76448301,"Nhận hàng khá thích , nguyên seal , cầm nặng_tay , âm_thanh nghe hay , pin nghe lâu .",5,0
22077966900,76448301,"Đồ đẹp lắm shop , đã mua bên shop 2 lần rồi , khá là ưng_ý , lần này đc tặng quà khá là xin sò nha , ,",5,0
22077966900,76448301,"Sản_phẩm đúng mẫu , đúng màu , máy hoạt_động tốt , giá_cả hợp_lí , giao hàng nhanh",5,0
22077966900,76448301,"Thời_gian gần đây , Shark_Thuỷ vướng vào lùm xùm nợ_nần từ lương giáo_viên , thuế đến vốn của nhà_đầu_tư , đang sở_hữu hệ_sinh_thái , khủng , ?",5,0
22077966900,76448301,"Hàng rất đẹp , đóng_gói hàng rất kỹ_càng , đúng với mô_tả của shop , sẽ quay lại ủng_hộ",5,0
22108938136,76448301,"Chất_lượng sản_phẩm : bthg Tính_năng nổi_bật : có hiển_thị pin hộp đựng tia nghe Giao_diện , mẫu_mã hàng miễn bàn đẹp xuất_sắc , hàng mới nguyên luôn .",3,0
22108938136,76448301,Hàng ngon đấy các bác ạ .,5,0
22108938136,76448301,Dùng đc 2 tuần thì cảm_thấy ổn âm to nghe rõ_ràng hiện_tại thì chưa thấy lỗi j cả,5,0
22108938136,76448301,"tai nghe ổn , với mức giá này thì khá là rẻ , sạc nửa tiếng là đầy và dùng đc khoảng 2 ngày",5,0
22108938136,76448301,Chất_lượng sản_phẩm : ok .,5,0
22108938136,76448301,Tai nghe nghe ổn màu cg đẹp giá gẻ nên mua nka ch chi mua đc 2 ngày bị dây_mực cần tìm cách tẩy mực ét ô ét,5,0
22108938136,76448301,"Mình vừa nhận hàng chưa dùng thử nhưng nhìn bên ngoài rất đẹp nha , shipper cũng dễ_thương nữa",5,0
22108938136,76448301,"Chất_lượng sản_phẩm : nhỏ gọn pin khá trâu âm_thanh khá hay nhưng đeo lâu sẽ bị đau tai nha nhựa nhám Nhỏ gọn pin khá trâu nghe hơn hai tiếng chỉ tuột có 30 , pin còn có bền không_thể chưa biết giao nhanh nữa nhưng shop đống gói sơ Sài không có chống sốc hộp bên ngoài bị móp hết trơn may_mà nhưng sản_phẩm không sao",5,0
22108938136,76448301,"Mình đã nhận dc hàng , gói hàng rất chắc_chắn ... dùng thử âm_thanh rất ok , nó chung rất hhai2 lòng về sản_phẩm ... thank shop , , ,",5,0
22108938136,76448301,"Hàng giao đúng hạn , mẫu_mã đẹp , k xước .",5,0
22108938136,76448301,"Tai nghe sau 1 tháng dùng rất ok , shop gói hàng cẩn_thận .",5,0
22108938136,76448301,Hàng dùng OK sợ với tầm giá .,5,0
22108938136,76448301,"Chất_lượng ok so với giá , chức_năng thì đầy_đủ nhưng âm thì cũng tạm được ko mong_đợi gì hơn so với giá này",5,0
22108938136,76448301,"Hàng khá ổn so với số tiền , shop trả_lời nhanh tin nhắn thời_gian dài không biết sao , tạm đánh_giá 5 ,",5,0
22108938136,76448301,"Sp cuz ok nhưng_mà tai nghe đôi_khi nghe đc 1 bên phải ngắt kn r kn lại mới nghe đc cả 2 , nắpđựng tai nghe hk được chắc_chắn lắm với khi lắc tổng_thể thì nghe tiếng lắc qua_lại",3,0
18242529127,76448301,"Sản_phẩm nhìn rất bắt_mắt , mắt trên của hộp làm_gương soi mặt .",5,0
18242529127,76448301,Chất_lượng sản_phẩm : tốt Tính_năng nổi_bật : nghe tốt .,5,0
18242529127,76448301,"Chất_lượng sản_phẩm : khá ổn số với tầm giá Sản_phẩm đúng như trên quảng_cáo , âm_thanh nghe khá tốt_số với tầm giá tiền , pin và dock sạc dùng được khá lâu , chỉ có tại bên trái dùng thấy nhanh hết pin hơn",4,0
18242529127,76448301,"Vì ms mua test thử âm thấy rất ưng , giao hàng nhanh còn về dung_lượng pin thì mk chưa test .",5,0
18242529127,76448301,Shop giao hàng nhanh lắm .,5,0
18242529127,76448301,"Chất_lượng sản_phẩm : tốt Giao hàng nhanh , đóng_gói chắc_chắn .. tạm ổn so với giá tiền .",5,0
18242529127,76448301,Shop gửi nhầm hàng quá thất_vọng mong shop chú_ý hơn về phân_loại hàng,2,1
18242529127,76448301,"hàng giao tuy hơi lâu nhưng khi nhận được rồi thì phải nói là rất ưng.tặng cho shop năm sao ,",5,0
18242529127,76448301,Đã nhận được sản_phẩm ship nhiệt_tình đóng_gói hàng cẩn_thận nhé .,5,0
18242529127,76448301,Đã nhận được hàng sản_phẩm ưng_ý .,5,0
18242529127,76448301,"Chất_lượng sản_phẩm : Tốt_Tính năng nổi_bật : bass cực căng Tai nghe cực căng , bass tuyệt_đỉnh .",5,0
18242529127,76448301,"Chất_lượng sản_phẩm : tốt trong tầm giá Đóng_gói hàng đẹp k móp méo , còn tai nghe thì nghe ổn nói_chung tầm giá đáng mua",5,0
18242529127,76448301,Nhận hàng bóc hàng ra và cảm_thấy rất ưng_ý và nhìn thấy rất chắc_chắn có cơ_hội sẽ ủng_hộ shop tiếp_tục .,5,0
18242529127,76448301,"Chất_lượng sản_phẩm : M 19 ổn nhưng không nghe hay bằng M10 , Rất_Dễ rớt khỏi tai , còn lại thì ổn pin cũng khá trâu Tính_năng nổi_bật : pin trâu Đặt loại M10 mà shop giao nhằm M19 :",4,0
18242529127,76448301,Tính_năng nổi_bật : âm_thanh rất tốt Chất_lượng sản_phẩm : tầm trung Chưa sử_dụng đã hư dây sạc .,3,0
16223230656,76448301,Rồi loa cx lo mà tắt kiểu j v xin hỏi shop loa tắt kiệu v nhấn mãi vẫn có nút đèn_xanh hát ok,5,0
16223230656,76448301,Giao đúng mẫu màu .,5,0
16223230656,76448301,Chất_lượng sản_phẩm : tốt Tính_năng nổi_bật : loa nghe êm kết_nối Bluetooth khá nhanh Đc nha mấy má ôi .,5,0
16223230656,76448301,"Chất_lượng sản_phẩm : Loa to Tính_năng nổi_bật : Loa bluetooth Sản_phẩm dùng tốt . loa mức 50 , cũng khá ok . bật FM như hướng_dẫn khá vui",5,0
16223230656,76448301,"Loa nhỏ nhưng nghe rất to , nhiều công_dụng , màu đen nhìn sang , rất đáng tiền.Shop rep tn nhanh , nhiệt_tình , gói hàng đẹp , giao hàng cũng nhanh",5,0
16223230656,76448301,"Huỳnh_Trần_Ý_Nhi trong video trả_lời phỏng_vấn gây tranh_cãi mới_đây khi so_sánh mình với , bạn_bè đồng trang_lứa , đã khẳng_định , hoa_hậu vẫn là người truyền_cảm hứng cho mọi người , , và thi hoa_hậu là , trưởng_thành hơn các bạn , .",5,0
16223230656,76448301,Sản_phẩm tốt .,5,0
16223230656,76448301,"Loa nghe rất ấm và êm . sản_phẩm phù_hợp với giá tiền , chất_lượng tương_đối ổn_định .",5,0
16223230656,76448301,"Loa nhỏ xinh_xinh , giao đúng màu đỏ .",5,0
16223230656,76448301,loa đẹp ạ ... dễ sử_dụng ... âm_thanh nge hay lắm mn nên mua với giá này thi ok nha,5,0
16223230656,76448301,Loa êm lắm nha nên mua nha mọi người thêm tiền mua cái to nghe cho êm ạ .,5,0
16223230656,76448301,Loa nhỏ_xíu ah mn .,5,0
16223230656,76448301,"Chất_lượng sản_phẩm : oK Tính_năng nổi_bật : nghe nhạc Giao hàng nhanh , âm_thanh nghe ổn_áp .",5,0
16223230656,76448301,"Đã test loa 2 ngày , to xịn , to quá phải mở bé bớt đi Không nghĩ mua được loa chất_lượng như_vậy Loa thiết_kế đẹp , hoàn_thiện hơn các sp đồng giá .",5,0
16223230656,76448301,"Sản_phẩm oke như hình , hoàn thiệt tốt nhỏ gọn mà loa khá lớn nha mọi người cứ mua trãi nghiệm tiện_lợi lắm .",5,0
23080283521,76448301,Củ sạc kg khít đc với dây sạc .,1,1
23080283521,76448301,Mình vừa mua dc 4 hôm củ sạc đã ko sạc dc nhắn_tin cho shop cũng ko bảo hỗ_trợ đổi hàng chỉ_bảo cắm vào củ sạc khác nhưng cũng ko dc coi như bỏ phí tiền,1,1
23080283521,76448301,Hàng đểu sạc hỏng nhắn_tin shop không giải_quyết chút nào cả,1,1
23080283521,76448301,Đưa bộ sạc hư đéo sạc đk đcm shop,1,1
23080283521,76448301,Chất_lượng tệ Dùng được 4 ngày thì đã hỏng,1,1
17581775903,76448301,1 trải_nghiệm tệ với dịch_vụ của shop .,1,1
17581775903,76448301,"Chất_lượng sản_phẩm : tạm Đúng với mô_tả : ko Về phần tai nghi thì tốt , loa bass ổn , pin thì chưa bt như nào nói_chung tạm ổn trong tầm giá Còn về phần ốp của tai nghe , mình đặt mã heo hồng mặc_dù có cả lưu_ý cho người bán nội_dung rõ_ràng , không hiểu kiểu gì lại giao ốp trong suốt cực thất_vọng về phần này",1,1
17581775903,76448301,"Đúng với mô_tả : ko đúng Mình đặt cả ip với ốp là ip3 mà ko hỉu s shop vẫn giao cho mình ốp pro2 đc , ko chịu kt trước khi giao",1,1
17581775903,76448301,Chất_lượng sản_phẩm : quá tệ ko dùng được Về bật ko lên .,1,1
17581775903,76448301,"Omg nâu , dùng đc tháng hỏng mẹ một bên :",1,1
17581775903,76448301,Chất_lượng sản_phẩm : kém quá kém cực kém Đúng với mô_tả : đặt pro lại giao inpod 3 . ko sạc được .,1,1
17581775903,76448301,Đúng với mô_tả : mua kèm ốp bảo_vệ hình lợn nhưng ship con mèo shop chảnh chó Chất_lượng sản_phẩm : dùng đt ios 16 loa rè như c nhưng dùng ios12 loa tàm_tạm Nói_chung shop như cack k nên mua,1,1
17581775903,76448301,Đây là cái cục nhựa vô_tri à ?,1,1
17581775903,76448301,Chất_lượng sản_phẩm : tốt Đúng với mô_tả : không đúng sản_phẩm,1,1
17581775903,76448301,"Đúng với mô_tả : ai mà biết Chất_lượng sản_phẩm : không biết , vì shop có thèm giao đâu Shop giao thiếu , ib shop thì shop bảo mình gửi lại địa_chỉ các kiểu để shop gửi bù .",1,1
17581775903,76448301,"Có được nhận đâu mà đánh_giá , nói_chung trải_nghiệm bên shop phải nói là Tệ .",1,1
17581775903,76448301,Bẩn vỏ giống như đã qua sử_dụng âm_thanh tạm ổn xước cả trong và ngoài Xước khá nhiều chỗ Shop làm_ăn vớ_vẩn tai nghe mic nói_chuyện nghe k rõ nt cho shop shop tl tai nghe chỉ đc vậy thôi :,1,1
17581775903,76448301,"Shop vô_trách_nhiệm giao thiếu hàng cho khách , đã ib riêng giải_quyết êm_đềm mà hơn 1 tuần rồi còn chưa ship .",1,1
17581775903,76448301,Chất_lượng sản_phẩm : kem Đặt vỏ tai nghe con rồng mà cuối_cùng nó cho mình cái vỏ tai nghe như rác vậy .,1,1
17581775903,76448301,Chất_lượng sản_phẩm : chất_lượng pin của hộp quá kém sạc 1 đêm mà sạc cho 2 cái tai nghe 2 lần hết pin trong hộp,1,1
22154458199,76448301,"Chất_lượng sản_phẩm : chat luong san pham kha te Tính_năng nổi_bật : nooo mk chia se trên quan_điểm cá_nhân của mình , mình vừa mua và sử_dụng .",1,1
